[
  {
    "slug": "test-sharding-cut-our-ci-wait-from-15-minutes-to-4",
    "title": "The Waiting Tax on Every PR: How Sharding Vitest Cut CI From 15 Minutes to 4.5",
    "description": "Every pull request sat for about 15 minutes behind one long unit-test job, and the team felt it. Splitting Vitest across parallel shards in GitHub Actions cut that to roughly 4 minutes, and it only took changing four files.",
    "date": "2026-06-25",
    "readingTime": "7 min read",
    "url": "https://medium.com/@hitesh.shetty2011/the-waiting-tax-on-every-pr-how-sharding-vitest-cut-ci-from-15-minutes-to-4-5-0e552f91253b",
    "tags": [
      "CI/CD",
      "GitHub Actions",
      "Vitest",
      "Testing",
      "Developer Experience"
    ]
  },
  {
    "slug": "how-i-improved-seo-score-from-82-to-100",
    "title": "My Site's SEO Score Was 82. Here's How I Got it to 100",
    "description": "My portfolio's Lighthouse SEO score was stuck at 82. See the exact steps I took with meta tags, sitemaps, open graph, and structured data to get a perfect 100 score.",
    "date": "2025-10-26",
    "readingTime": "10 min read",
    "url": "https://medium.com/@hitesh.shetty2011/my-sites-seo-score-was-82-here-s-how-i-got-it-to-100-9289ba5d5294",
    "tags": [
      "SEO",
      "Lighthouse",
      "Guides & Tutorials",
      "Open Graph & Twitter Cards",
      "Next.js"
    ]
  },
  {
    "slug": "deploying-a-next-js-static-site-on-github-pages-with-a-custom-domain",
    "title": "Deploying a Next.js Static Site on GitHub Pages with a Custom Domain",
    "description": "A step‑by‑step guide to hosting a Next.js site on GitHub Pages with a custom domain",
    "date": "2025-10-19",
    "readingTime": "4 min read",
    "url": "https://medium.com/@hitesh.shetty2011/deploying-a-next-js-static-site-on-github-pages-with-a-custom-domain-671754d63eb4",
    "tags": ["Next.js", "GitHub Pages", "Custom Domain", "Guides & Tutorials"]
  },
  {
    "slug": "the-transaction-that-never-ended-how-duplicate-ids-turned-my-backend-into-a-cpu-hungry-monster",
    "title": "The Transaction That Never Ended: How Duplicate IDs Turned My Backend Into a CPU-Hungry Monster",
    "description": "It was 3 PM, and my server was screaming. CPU usage at 99%, database connections maxed out, and my load testing had just turned into a load shedding nightmare. All because of a transaction that refused to give up…",
    "date": "2025-09-21",
    "readingTime": "5 min read",
    "url": "https://medium.com/@hitesh.shetty2011/the-transaction-that-never-ended-how-duplicate-ids-turned-my-backend-into-a-cpu-hungry-monster-7ccc613832c9",
    "tags": ["Mongodb", "Performance", "Load Testing", "Observability"]
  },
  {
    "slug": "how-two-factor-authentication-works-deep-dive",
    "title": "How Two-Factor Authentication (2FA) Works: A Deep Dive into Enhanced Security",
    "description": "In this blog post, we'll delve into what 2FA is, why it's essential, and how it functions, using practical examples to guide you through the process.",
    "date": "2024-08-25",
    "readingTime": "5 min read",
    "url": "https://medium.com/@hitesh.shetty2011/how-two-factor-authentication-2fa-works-a-deep-dive-into-enhanced-security-30dd5007ad73",
    "tags": ["2fa Authentication", "Security", "TOTP"]
  }
]
